[
  {
    "user_input": "what kind of info is in the student handbook? like does it help with my health issues?",
    "response": "The Student Handbook includes information on academic requirements, policies and procedures related to University life. It also provides details about support for wellbeing concerns such as mental health or disabilities through resources available in the Disability, Mental Health and Wellbeing Team within UCL's SSW department.",
    "retrieved_contexts": [
      "Departmental Tutor, Teaching & Learning Manager\n\n1.4 About the Student Handbook\n\nThe Computer Science Student Handbook is intended to provide you with key information regarding the Department of Computer Science and its taught degree programmes. It includes details of academic requirements, notification and explanation of codes, regulations, policies and procedures, as well as the other aspects of University life - sources of help and support, student representation, social opportunities, and facilities and resources available. Additional programme-specific information is detailed in the Programme Summary, which relates specifically to your year of entry.\n\nWhere information is available via UCL Students webpages or in the Academic Manual, which you should familiarise yourself with, this has been summarised but not replicated in full. Instead, links are given to the relevant materials so that you can be sure you are accessing the most up to date information.",
      "A key contact for you during your time studying at UCL is your Student Representative. They are a fellow student on your degree programme and are there to present the views of your cohort. Through discussion and collaboration with staff in the department they aim to make your experience the best it can be. Find out more about them via the student intranet.\n\nYou can get in touch with us via email, drop-in to one of our regular online sessions, or make an appointment for a face-to-face chat. However you choose to reach out, the team is here to support you throughout your time with us.\n\nBest wishes for the year ahead.\n\nLewis Griffin & Jo Stiles\n\nDepartmental Tutor, Teaching & Learning Manager\n\n1.4 About the Student Handbook",
      "15.1.3 Student Advisers for First Year Undergraduates\n\nUCL Student Advisers are a key contact for first-year undergraduates for any wellbeing, support and student experience matters. They can help students navigate any aspects of student life that may appear challenging, including policies, assessments and finding the right kind of support. All UCL departments have dedicated Student Advisers who make contact with students before the start of the academic year to introduce their role and offer individual appointments.\n\nMeet the Student Advisers | UCL Students\n\n15.1.4 Disability, Mental Health and Wellbeing team",
      "Meet the Student Advisers | UCL Students\n\n15.1.4 Disability, Mental Health and Wellbeing team\n\nThe Disability, Mental Health and Wellbeing Team in Student Support and Wellbeing (SSW) provide a safe, confidential and non-judgemental space, in which students can discuss any wellbeing, mental health and/or disability concerns that may be affecting their ability to study. This encompasses any personal or emotional challenges students may be experiencing, mental health difficulties such as anxiety or depression and long-term health conditions. The service also supports students with physical and sensory impairments, specific learning difficulties, and autistic spectrum conditions. As well as arranging for adjustments to learning environments, the team loan out specialist equipment. They provide one-to-one tutoring and support for students with specific learning difficulties and mentoring for students with mental health conditions.\n\nSupport for disabled students | UCL Students"
    ],
    "reference": "The Student Handbook includes welcome messages from UCL\u2019s President and Provost and the Computer Science Head of Department, information about the scope and purpose of the Student Handbook, and general advice about changes to information through the year."
  }
]